{"$schema":"https://json-schema.org/draft/2020-12/schema","title":"Loom Studio Validation Manifest","type":"object","required":["milestone","name","branch","status","acceptance","signoff"],"properties":{"milestone":{"type":"string"},"name":{"type":"string"},"branch":{"type":"string"},"status":{"type":"string"},"purpose":{"type":"string"},"commands":{"type":"object","additionalProperties":{"type":"string"}},"environment":{"type":"object"},"product_language":{"type":"object"},"acceptance":{"type":"array","items":{"type":"object","required":["id","area","requirement","method","automated","status"],"properties":{"id":{"type":"string"},"area":{"type":"string"},"requirement":{"type":"string"},"method":{"type":"string"},"automated":{"type":"boolean"},"status":{"enum":["pending","passed","failed","blocked","waived"]},"evidence":{"type":"array","items":{"type":"string"}},"notes":{"type":"array","items":{"type":"string"}}},"additionalProperties":false}},"signoff":{"type":"object","required":["validated_by","validated_at","commit","notes"]}},"additionalProperties":true}
